Budget général;Enseignement scolaire;P214;Soutien de la politique de l'éducation nationale;401;P214.3;Optimiser les moyens des fonctions support;397;P214.3.1;Dépense de fonctionnement par agent;Contribuable;;22010;Fonctionnement immobilier : moyenne nationale;euro;829;878;< 830;< 830;< 830;2020;< 830;MIN06;Éducation nationale
Budget général;Recherche et enseignement supérieur;P150;Formations supérieures et recherche universitaire;2351;P150.6;Améliorer l'efficience des opérateurs;2385;P150.6.1;Part des mentions à faibles effectifs (L et M);Contribuable;;3952;Part des mentions à faibles effectifs (M): inférieur à 30;%;35,2;36;31,2;35.2;36.5;2020;22;MIN38;Enseignement supérieur, recherche et innovation
Comptes de concours financiers;Prêts et avances à des particuliers ou à des organismes privés;P862;Prêts pour le développement économique et social;3201;P862.1;Appuyer les dispositifs de sauvegarde des entreprises;3711;P862.1.1;Effet de levier sur les capitaux privés d'un prêt pour le développement économique et social;Contribuable;;7904;Effet de levier sur les capitaux privés d'un prêt pour le développement économique et social;Ratio;5;7,3;5;3.4;5;2020;5;MIN21;Économie et finances
Budget général;Administration générale et territoriale de l'État;P232;Vie politique, cultuelle et associative;2003;P232.1;Organiser les élections au meilleur coût;2003;P232.1.1;Coût moyen de l'élection par électeur inscrit sur les listes électorales;Contribuable;;16154;Part du coût de la propagande par électeur - Élections régionales;€/électeur inscrit;2,29;s.o.;s.o.;s.o.;s.o.;2020;s.o.;MIN09;Intérieur
Budget général;Justice;P101;Accès au droit et à la justice;515;P101.2;Améliorer l'allocation des ressources consacrées à l'aide juridictionnelle;515;P101.2.1;Coût de traitement d'une décision d'aide juridictionnelle;Contribuable;;8067;Coût de traitement d'une décision d'aide juridictionnelle;€;14,06;13,45;<14,5;<14;<14;2020;<14;MIN10;Justice
Comptes d'affectation spéciale;Développement agricole et rural;P776;Recherche appliquée et innovation en agriculture;3463;P776.1;Renforcer l'orientation des appels à projets et des programmes pluriannuels sur les priorités des politiques publiques portées par le ministère chargé de l'agriculture;4084;P776.1.1;Part des financements correspondant aux priorités retenues pour l'évolution qualitative;Citoyen;;7926;Appel à projets : part des financements impliquant une unité mixte technologique (UMT) ou un réseau mixte thématique (RMT);%;73,6;72,54;57;57;57;2020;57;MIN03;Agriculture et alimentation
Budget général;Santé;P204;Prévention, sécurité sanitaire et offre de soins;3578;P204.2;Prévenir et maîtriser les risques sanitaires;3890;P204.2.3;Délai de traitement des autorisations de mise sur le marché (AMM);Usager;;5221;ANSM : Délai moyen AMM reconnaissance mutuelle et décentralisée;nombre de jours;ND;ND;30;30;30;2020;30;MIN56;Solidarités et santé
Budget général;Enseignement scolaire;P214;Soutien de la politique de l'éducation nationale;388;P214.2;Améliorer la qualité de la gestion des ressources humaines;12650;P214.2.4;Efficacité et efficience du remplacement des personnels enseignants des premier et second degrés public;Contribuable;;8195;Enseignement scolaire public du second degré : Taux d'optimisation du potentiel de professeurs remplaçants;%;87,3;89,2;88;88;88;2020;88.5;MIN06;Éducation nationale
Budget général;Gestion des finances publiques et des ressources humaines;P156;Gestion fiscale et financière de l'État et du secteur public local;11661;P156.1;Améliorer l'efficacité du recouvrement, de la lutte contre la fraude fiscale et du traitement des dépenses publiques;13345;P156.1.1;Taux de déclaration et de recouvrement spontanés (civisme);Citoyen;;16659;Taux d'usagers particuliers respectant leurs obligations déclaratives;%;97,9;97,53;>=98;>=97,50;>=98;2020;>=98;MIN07;Action et comptes publics
Comptes d'affectation spéciale;Pensions;P742;Ouvriers des établissements industriels de l'État;3566;P742.1;Maîtriser les coûts de la gestion administrative inclus dans la dépense totale;4331;P742.1.2;Dépenses de gestion pour 100€ de pension;Contribuable;;6158;Masse des prestations servies;M€;1831;1839;1846;1859;1870;2020;1885;MIN07;Action et comptes publics
Comptes d'affectation spéciale;Financement des aides aux collectivités pour l'électrification rurale;P793;Électrification rurale;11569;P793.2;Sécurisation des réseaux basse tension en fils nus;14117;P793.2.1;Nombre de km de fil nu;Citoyen;;23338;Nombre de km de fil nu de faible section;Nombre;ND;17 500;18 000;17500;16000;2020;15000;MIN23;Transition écologique et solidaire
Budget général;Solidarité, insertion et égalité des chances;P304;Inclusion sociale et protection des personnes;10393;P304.1;Inciter à l'activité et au maintien dans l'emploi;11929;P304.1.1;Part des foyers allocataires du RSA en reprise d'activité qui accèdent à la prime d'activité et se maintiennent dans l'emploi;Citoyen;;21894;Part des couples allocataires du RSA sans emploi dont au moins un des membres accédant à la prime d'activité est une femme;%;SO;30,4;31;31;31.5;2020;32;MIN56;Solidarités et santé
Comptes d'affectation spéciale;Participation de la France au désendettement de la Grèce;P796;Rétrocessions de trop-perçus à la Banque de France;;;;;;;;;;;;;;;;;;;MIN21;Économie et finances
Budget général;Action extérieure de l'État;P185;Diplomatie culturelle et d'influence;20;P185.4;Dynamiser les ressources externes;11369;P185.4.1;Autofinancement et partenariats;Contribuable;;13151;Montant des participations externes mobilisés par le réseau culturel et de coopération;M€;161;165;154;172;172;2020;172;MIN01;Europe et affaires étrangères
Budget général;Immigration, asile et intégration;;;10293;MIA.1 (P303.3);Améliorer l'efficacité de la lutte contre l'immigration irrégulière;10651;P303.3.1;Nombre de retours forcés exécutés;Citoyen;Stratégique mission;23142;Part des retours forcés de ressortissants de pays tiers (RPT) vers pays tiers (PT);%;48;44;48;48;48;2020;48;;
Comptes de concours financiers;Avances à l'audiovisuel public;P841;France Télévisions;3442;P841.3;Assurer la maîtrise de l'emploi et de la masse salariale et optimiser la gestion;4549;P841.3.2;Ressources propres;Contribuable;;7816;Ressources propres;M€;400,6;399,5;n.d.;378.4;n.d.;2020;n.d.;MIN07;Action et comptes publics
Budget général;Écologie, développement et mobilité durables;P174;Énergie, climat et après-mines;12347;P174.2;Réduire les émissions de gaz à effet de serre;14435;P174.2.1;Emissions de gaz à effet de serre par habitant;Citoyen;;23560;Emissions de gaz à effet de serre par habitant;MtCO2eq/hab;6,34;6,33;5,72;6.1;6;2020;5.47;MIN23;Transition écologique et solidaire
Budget général;Cohésion des territoires;P112;Impulsion et coordination de la politique d'aménagement du territoire;2135;P112.2;Accompagner les mutations économiques et renforcer la cohésion sociale et territoriale;14236;P112.2.2;Réduction du temps d'accès des usagers à une maison de services au public;Usager;;23326;Taux de population dans les communes de moins de 30 000 habitants à moins de 20 min d'une MSAP;%;52;68;90;75;90;2020;100;MIN45;Cohésion des territoires
Budget général;Enseignement scolaire;;;12229;MEC.1;Conduire tous les élèves à la maîtrise des connaissances et compétences du socle commun jusqu'en fin de 3ème;14928;MEC.1.1;"Proportion d'élèves maîtrisant, à chaque fin de cycle d'enseignement, les principales composantes du domaine 1 ""les langages pour penser et communiquer"" du socle commun (champ enseignement public)";Citoyen;Stratégique mission;25776;Comprendre, s'exprimer en utilisant les langages mathématiques, scientifiques et informatiques, en fin de 3ème (domaine 1);%;73,1;s.o.;s.o.;s.o.;78;2020;s.o.;;
Budget général;Pouvoirs publics;P531;Conseil constitutionnel;;;;;;;;;;;;;;;;;;;MIN07;Action et comptes publics
Budget général;Travail et emploi;P102;Accès et retour à l'emploi;914;P102.1;Favoriser l'accès et le retour à l'emploi;2910;P102.1.2;Taux de retour à l'emploi de tous les publics;Citoyen;;12335;Travailleurs handicapés;%;1,9;1,8;1,8;1.8;1.9;2020;2.2;MIN36;Travail
Budget général;Cohésion des territoires;P109;Aide à l'accès au logement;998;P109.1;Aider les ménages modestes à faire face à leurs dépenses de logement;2889;P109.1.1;Taux d'effort net médian des ménages en locatif ordinaire ou en accession selon la configuration familiale et le type de parc;Citoyen;;25063;Familles monoparentales avec 2 enfants;%;15,6;15,7;15,4;15.7;15.7;2020;15.7;MIN45;Cohésion des territoires
Budget général;Cohésion des territoires;;;2130;MVA.5 (P112.1);Soutenir la compétitivité et l'attractivité des territoires;4511;P112.1.2;Ecart du taux de création d'entreprises dans les zones prioritaires d'aménagement du territoire par rapport à la moyenne nationale;Citoyen;Stratégique mission;7817;Ecart du taux de création d'entreprises dans les zones prioritaires d'aménagement du territoire par rapport à la moyenne nationale;écart;-1,2;-1,0;-1,0;-1.9;-1.9;2020;-1;;
Budget général;Conseil et contrôle de l'État;;;464;MCA.3 (P165.1);Réduire les délais de jugement;14690;P165.1.1;Délai moyen constaté de jugement des affaires;Usager;Stratégique mission;24557;à la Cour nationale du droit d'asile, pour les procédures accélérées;année;13 semaines;13 semaines;9 semaines;20 semaines;5 semaines;2020;5 semaines;;
Budget général;Enseignement scolaire;P139;Enseignement privé du premier et du second degrés;11761;P139.4;Répondre aux besoins éducatifs de tous les élèves sur l'ensemble du territoire;375;P139.4.1;Scolarisation des élèves en situation de handicap dans l'enseignement primaire et secondaire;Citoyen;;17681;6. 2nd degré - Pour information : Proportion d'élèves en situation de handicap parmi les élèves de collège;%;2,3;2,3;s.o;s.o;s.o;2020;s.o;MIN06;Éducation nationale
Budget général;Agriculture, alimentation, forêt et affaires rurales;P215;Conduite et pilotage des politiques de l'agriculture;92;P215.3;Mettre en oeuvre les actions ministérielles dans des conditions optimales de coût et de qualité de service;4347;P215.3.1;Efficience de la fonction immobilière;Contribuable;;23998;Taux d'écart calendaire agrégé des projets d'infrastructure;%;2,4;2,37;3;1.39;1;2020;2018-05-10T00:00:00;MIN03;Agriculture et alimentation
Budget général;Justice;;;473;MJA.1 (P166.1);Améliorer la qualité et l'efficacité de la justice;473;P166.1.1;Délai moyen de traitement des procédures civiles, hors procédures courtes;Usager;Stratégique mission;473;Cours d'appel;Mois;13,9;14,7;13,7;15;14;2020;13;;
Budget général;Sport, jeunesse et vie associative;P219;Sport;776;P219.2;Promouvoir la rigueur financière et l'efficacité des fédérations sportives;777;P219.2.2;Indépendance financière des fédérations sportives;Contribuable;;16544;Nombre de fédérations sportives présentant un taux d'autofinancement inférieur à 50% (Subvention Ministère chargé des sports >50%);nombre;2;1;2;1;1;2020;2;MIN52;Sports
Comptes de concours financiers;Avances à l'audiovisuel public;P842;ARTE France;11125;P842.2;Diffuser cette offre de programmes au public le plus large, sur tous les supports, partout en Europe;10169;P842.2.1;Audiences linéaire et non linéaire;Citoyen;;20720;Nombre de vidéos vues par mois sur l'ensemble des plateformes de diffusion;Million;22,2;37,2;>2017;>2017;idem 2018;2020;>2019;MIN07;Action et comptes publics
Budgets annexes;Contrôle et exploitation aériens;P612;Navigation aérienne;2501;P612.4;Améliorer l'efficacité économique des services de navigation aérienne;2588;P612.4.2;Évolution du coût unitaire des unités de service de navigation aérienne;Contribuable;;6488;Evolution du coût unitaire de route français;%;-2,2;-3*;<0;0,6*;<0;2020;<0;MIN23;Transition écologique et solidaire
Budget général;Immigration, asile et intégration;P104;Intégration et accès à la nationalité française;754;P104.1;Améliorer les conditions d'accueil et d'intégration des étrangers;755;P104.1.1;Efficience de la formation linguistique dans le cadre du CAI/CIR (contrat d'accueil et d'intégration/contrat d'intégration républicaine);Contribuable;;24091;Coût moyen de gestion de la formation linguistique dans le cadre du CAI/CIR;€;0,17;0,15;0,15;0.15;0.15;2020;0.15;MIN09;Intérieur
Budget général;Gestion des finances publiques et des ressources humaines;P218;Conduite et pilotage des politiques économiques et financières;449;P218.3;Maîtriser le coût des fonctions support;3633;P218.3.3;Ratio d'efficience de la gestion des ressources humaines;Contribuable;;4898;Ratio d'efficience de la gestion des ressources humaines;%;2,3;2,3;2,3;2.3;2.3;2020;2.3;MIN07;Action et comptes publics
Budget général;Agriculture, alimentation, forêt et affaires rurales;P149;Compétitivité et durabilité de l'agriculture, de l'agroalimentaire, de la forêt, de la pêche et de l'aquaculture;74;P149.1;Combiner la performance économique et environnementale des exploitations agricoles, des filières agroalimentaires et forestières;11080;P149.1.3;Récolte de bois rapportée à la production biologique;Citoyen;;13467;Récolte de bois rapportée à la production biologique;%;47,4;49,6;48,2;48.2;50;2020;53;MIN03;Agriculture et alimentation
Budget général;Enseignement scolaire;P140;Enseignement scolaire public du premier degré;305;P140.1;Conduire tous les élèves à la maîtrise des connaissances et compétences du socle commun exigibles au terme de la scolarité primaire;311;P140.1.3;Scolarisation des élèves du 1er degré en situation de handicap;Citoyen;;19814;Taux de couverture des notifications d'affectation en ULIS écoles;%;87,2;86,6;96;90;94;2020;98;MIN06;Éducation nationale
Budget général;Travail et emploi;P155;Conception, gestion et évaluation des politiques de l'emploi et du travail;2625;P155.2;Accroître l'efficience de la gestion des moyens;14194;P155.2.3;Efficience de la fonction achat;Contribuable;;23254;Efficience de la fonction achat;millions d'€;6,23;5,4;6;6;n.c.;2020;n.c.;MIN36;Travail
Budget général;Sécurités;P176;Police nationale;2192;P176.1;Évaluer objectivement la prévention de la délinquance;12196;P176.1.1;Évolution du nombre de crimes et délits et de victimes en matière d'atteintes volontaires à l'intégrité physique (AVIP) constatés en zone police;Citoyen;;21936;Nombre des violences physiques crapuleuses;Nombre;94 220;88 140;en baisse;en baisse;en baisse;2020;en baisse;MIN09;Intérieur
Budget général;Cohésion des territoires;P135;Urbanisme, territoires et amélioration de l'habitat;1008;P135.2;Promouvoir la mixité sociale au sein des agglomérations au travers de la mixité de l'offre;2619;P135.2.1;Atteinte des objectifs annuels de financement de logements locatifs sociaux (LLS) dans les communes soumises à l'article 55 de la loi du 13 décembre 2000 relative à la solidarité et au renouvellement urbains (SRU);Citoyen;;23401;Nombre de communes soumises au taux de 20%;Nombre;497;474;311;441;266;2020;222;MIN45;Cohésion des territoires
Budget général;Sécurités;P176;Police nationale;2191;P176.2;Renforcer l'activité des services pour mieux combattre la délinquance;14050;P176.2.2;Lutte contre les filières, l'économie souterraine et les profits illicites;Citoyen;;23145;Nombre de personnes mises en cause pour trafic ou revente de produits stupéfiants;nombre;20 439;23 317;en hausse;en hausse;en hausse;2020;en hausse;MIN09;Intérieur
Budget général;Gestion des finances publiques et des ressources humaines;P156;Gestion fiscale et financière de l'État et du secteur public local;11661;P156.1;Améliorer l'efficacité du recouvrement, de la lutte contre la fraude fiscale et du traitement des dépenses publiques;13345;P156.1.1;Taux de déclaration et de recouvrement spontanés (civisme);Citoyen;;18090;Taux d'usagers professionnels respectant leurs obligations déclaratives;%;95,22;95,32;94,5;94.5;94.5;2020;94.5;MIN07;Action et comptes publics
Budget général;Solidarité, insertion et égalité des chances;P157;Handicap et dépendance;11368;P157.2;Développer l'insertion professionnelle des travailleurs handicapés - usagers des ESAT;12628;P157.2.1;Qualité de l'accueil, de la formation et de l'accompagnement en ESAT;Usager;;25806;Ratio d'égalité femmes-hommes pour l'accès en ESAT;%;ND;ND;SO;ND;40;2020;42;MIN12;Services du Premier ministre
Budget général;Administration générale et territoriale de l'État;P216;Conduite et pilotage des politiques de l'intérieur;59;P216.2;Améliorer la performance des fonctions supports;11898;P216.2.2;Efficience informatique et bureautique;Contribuable;;6296;Nombre d'heures d'indisponibilité des applications;heure;28h38;32h24;35;35;35;2020;35;MIN09;Intérieur
Budget général;Enseignement scolaire;P141;Enseignement scolaire public du second degré;325;P141.1;Conduire le maximum de jeunes aux niveaux de compétences attendues en fin de formation initiale et à l'obtention des diplômes correspondants;10095;P141.1.2;"Proportion d'élèves maîtrisant, en fin de troisième, les principales composantes du domaine 1 ""les langages pour penser et communiquer"" du socle commun";Citoyen;;10173;Comprendre, s'exprimer en utilisant la langue française à l'oral et à l'écrit (domaine 1)  - total;%;s.o.;s.o;s.o;s.o;80;2019;80;MIN06;Éducation nationale
Comptes d'affectation spéciale;Services nationaux de transport conventionnés de voyageurs;P785;Exploitation des services nationaux de transport conventionnés;11167;P785.2;Améliorer la qualité et la régularité des services nationaux de transport conventionnés;12319;P785.2.1;Régularité des services nationaux de transport conventionnés;Usager;;20856;Ponctualité terminus à 15 minutes des trains de nuit;%;86,9;81.5;87;87;87;2020;87;MIN23;Transition écologique et solidaire
Budget général;Recherche et enseignement supérieur;P186;Recherche culturelle et culture scientifique;699;P186.1;Promouvoir, auprès du public le plus large, la recherche culturelle et la culture scientifique et technique;2553;P186.1.1;Évolution du nombre annuel de visiteurs physiques d'Universcience, opérateur de la culture scientifique et technique;Usager;;17629;Fréquentation physique;Nombre de millions;2,45;2,5;2,63;2.63;2.8;2020;2.67;MIN02;Culture
Budget général;Enseignement scolaire;P230;Vie de l'élève;349;P230.2;Promouvoir la santé des élèves et contribuer à améliorer leur qualité de vie;12647;P230.2.3;Taux de couverture des prescriptions des commissions des droits et de l'autonomie des personnes handicapées pour la scolarisation des élèves en situation de handicap;Citoyen;;20629;A - Pour information : taux de couverture des prescriptions d'aide humaine individuelle;%;93,4;92,6;s.o.;s.o.;s.o.;2020;s.o.;MIN06;Éducation nationale
Budget général;Écologie, développement et mobilité durables;P159;Expertise, information géographique et météorologie;582;P159.4;Météo-France : disposer d'un système performant de prévision météorologique et d'avertissement des risques météorologiques;14816;P159.4.1;Performance des modèles de prévision numérique du temps et de la procédure de vigilance météorologique;Usager;;24958;Pourcentage d'évènements détectés avec une anticipation supérieure à 3 heures;%;82;89;>86;>86;>86;2020;>86;MIN23;Transition écologique et solidaire
Budget général;Solidarité, insertion et égalité des chances;P157;Handicap et dépendance;11368;P157.2;Développer l'insertion professionnelle des travailleurs handicapés - usagers des ESAT;12628;P157.2.1;Qualité de l'accueil, de la formation et de l'accompagnement en ESAT;Usager;;25807;Part des travailleurs handicapés (en ESAT) faisant l'objet d'un accompagnement dans l'emploi en milieu ordinaire de travail;%;NA;NA;SO;NA;5;2020;6;MIN12;Services du Premier ministre
Budget général;Justice;P107;Administration pénitentiaire;491;P107.3;Renforcer la sécurité des établissements pénitentiaires;14927;P107.3.3;Taux de détenus radicalisés ayant suivi un programme de prévention de la radicalisation violente;Citoyen;;25770;Taux de détenus radicalisés ayant suivi un programme de prévention de la radicalisation violente;%;ND;22,6;SO;50;60;2020;75;MIN10;Justice
Budget général;Défense;;;200;MDA.2 (P146.1);Mettre à la disposition des armées les armements et matériels nécessaires au succès des opérations des forces armées;3286;P146.1.1;Taux de réalisation des équipements;Citoyen;Stratégique mission;16063;Progression dans la réalisation des opérations d'armement principales;%;67,2;65,8;85;85;85;2020;85;;
Budget général;Justice;P107;Administration pénitentiaire;498;P107.1;Favoriser la réinsertion;498;P107.1.3;Pourcentage de détenus bénéficiant d'une formation générale ou professionnelle;Citoyen;;23594;Indicateur de contexte : nombre d'heures professeurs de l'éducation nationale pour 100 détenus;heures;21,9;20,5;22;21;21;2020;22;MIN10;Justice
Budget général;Sécurités;P176;Police nationale;2192;P176.1;Évaluer objectivement la prévention de la délinquance;12196;P176.1.1;Évolution du nombre de crimes et délits et de victimes en matière d'atteintes volontaires à l'intégrité physique (AVIP) constatés en zone police;Citoyen;;21938;Nombre de victimes de violences physiques non crapuleuses et violences sexuelles;Nombre;236 694;235 922;suivi;suivi;suivi;2020;suivi;MIN09;Intérieur
Budget général;Sport, jeunesse et vie associative;P219;Sport;775;P219.1;Réduire les inégalités d'accès à la pratique sportive;775;P219.1.1;Pratique sportive des publics prioritaires;Usager;;16442;Taux de licences des jeunes de 14 à 20 ans;%;54,7;56,1;55,1;56.5;57;2020;57.5;MIN52;Sports
Budget général;Régimes sociaux et de retraite;P197;Régimes de retraite et de sécurité sociale des marins;11084;P197.1;Optimiser le régime de protection sociale des marins;710;P197.1.3;Taux de recouvrement « global »;Contribuable;;710;Échéance : 3 mois;%;95,7;97,8;95;95;95;2020;95.5;MIN23;Transition écologique et solidaire
Budget général;Administration générale et territoriale de l'État;P216;Conduite et pilotage des politiques de l'intérieur;59;P216.2;Améliorer la performance des fonctions supports;11898;P216.2.2;Efficience informatique et bureautique;Contribuable;;17280;Ratio d'efficience bureautique;€/poste;543;1537;589;802;777;2020;560;MIN09;Intérieur
Budget général;Recherche et enseignement supérieur;;;12070;MRA.2;Accroître la production scientifique des opérateurs de recherche et leur dynamisme autour de la stratégie nationale de recherche (SNR);13977;MRA.2.2;Performances bibliométriques des périmètres scientifiques portant les défis de la stratégie nationale de recherche (SNR);Citoyen;Stratégique mission;23043;Gestion sobre des ressources et adaptation au changement climatique;%;n.s.;n.s.;n.s.;n.s;n.s.;2020;n.s.;;
Budget général;Gestion des finances publiques et des ressources humaines;P156;Gestion fiscale et financière de l'État et du secteur public local;11661;P156.1;Améliorer l'efficacité du recouvrement, de la lutte contre la fraude fiscale et du traitement des dépenses publiques;13345;P156.1.1;Taux de déclaration et de recouvrement spontanés (civisme);Citoyen;;24943;Taux brut de recouvrement des impôts des professionnels (hors CF);%;99,3;99,4;>=99;>= 99;>= 99;2020;>=99;MIN07;Action et comptes publics
Budget général;Administration générale et territoriale de l'État;P232;Vie politique, cultuelle et associative;2003;P232.1;Organiser les élections au meilleur coût;2003;P232.1.1;Coût moyen de l'élection par électeur inscrit sur les listes électorales;Contribuable;;19759;Part du coût de la propagande par électeur - Élections présidentielles;€/électeur inscrit;s.o.;2,81;s.o.;s.o.;s.o.;2020;s.o.;MIN09;Intérieur
Budget général;Enseignement scolaire;P141;Enseignement scolaire public du second degré;325;P141.1;Conduire le maximum de jeunes aux niveaux de compétences attendues en fin de formation initiale et à l'obtention des diplômes correspondants;12648;P141.1.6;Proportion d'élèves entrant en 3ème avec au moins un an de retard;Citoyen;;24112;Total REP;%;23,2;21,5;20;20;18.5;2020;18;MIN06;Éducation nationale
Budget général;Régimes sociaux et de retraite;P197;Régimes de retraite et de sécurité sociale des marins;11084;P197.1;Optimiser le régime de protection sociale des marins;12233;P197.1.2;Dépenses de gestion pour 1 € de pension;Contribuable;;18393;Ratio (a/b);c€;0,81;0,82;0,83;0.87;0.82;2020;0.81;MIN23;Transition écologique et solidaire
Budget général;Relations avec les collectivités territoriales;P119;Concours financiers aux collectivités territoriales et à leurs groupements;2158;P119.1;Promouvoir les projets de développement local, en assurant un équilibre entre maximisation de l'effet de levier et concentration des fonds sur des projets structurants pour les collectivités;15046;P119.1.2;Pourcentage de projets financés par la DETR et la DSIL concourant à la transition écologique;Citoyen;;26027;% de projets soutenus par la DETR ou la DSIL  concourant à la transition écologique (portant notamment sur la rénovation thermique des biens des collectivités, le développement des énergies renouvelables, le recyclage des déchets, les transports);%;SO;SO;SO;SO;35;2020;35;MIN09;Intérieur
