Budget général;Action et transformation publiques;P349;Fonds pour la transformation de l'action publique;12547;P349.2;S'assurer de l'efficacité des projets financés;14845;P349.2.1;Part des projets ayant un impact direct sur la qualité de service aux usagers ou sur la qualité de travail des agents;Citoyen;;26086;Part des projets ayant un impact direct sur la qualité de service aux usagers ou sur la qualité de travail des agents;%;SO;SO;SO;50;50;2020;50;MIN07;Action et comptes publics
Budget général;Enseignement scolaire;;;12229;MEC.1;Conduire tous les élèves à la maîtrise des connaissances et compétences du socle commun jusqu'en fin de 3ème;14928;MEC.1.1;"Proportion d'élèves maîtrisant, à chaque fin de cycle d'enseignement, les principales composantes du domaine 1 ""les langages pour penser et communiquer"" du socle commun (champ enseignement public)";Citoyen;Stratégique mission;25771;Comprendre, s'exprimer en utilisant la langue française à l'oral et à l'écrit, en fin de CE2 (domaine 1);%;s.o.;79,1;s.o.;s.o.;s.o;2020;89;;
Budget général;Sécurités;P152;Gendarmerie nationale;2218;P152.2;Renforcer l'activité des services pour mieux combattre la délinquance;13389;P152.2.3;Généralisation de la police technique et scientifique;Citoyen;;13009;Taux de signalisation biologique au Fichier National d'Analyse des Empreintes Génétiques (FNAEG);%;74,7;78,35;en hausse;en hausse;en hausse;2020;en hausse;MIN09;Intérieur
Budget général;Direction de l'action du Gouvernement;P308;Protection des droits et libertés;11043;P308.3;Optimiser la gestion des fonctions support;12213;P308.3.4;Part des bénéficiaires de l'obligation d'emploi prévue par la loi n°87-517 du 10 juillet 1987;Citoyen;;18166;Part de l'effectif du CNIL;%;2,1;2,6;3;2;2.5;2020;4;MIN12;Services du Premier ministre
Budget général;Sport, jeunesse et vie associative;P219;Sport;775;P219.1;Réduire les inégalités d'accès à la pratique sportive;775;P219.1.1;Pratique sportive des publics prioritaires;Usager;;16440;Pour information : Nombre de licences;Million;16,2;16,4;S.O.;S.O.;S.O.;2020;S.O.;MIN52;Sports
Budget général;Cohésion des territoires;P112;Impulsion et coordination de la politique d'aménagement du territoire;2130;P112.1;Soutenir la compétitivité et l'attractivité des territoires;4509;P112.1.1;Efficience des financements attribués aux entreprises bénéficiaires de la prime d'aménagement du territoire;Citoyen;;20894;Montant des investissements réalisés par les entreprises bénéficiaires de la PAT pour un euro de PAT attribué;€;13,5;18;23;26;42;2020;31;MIN45;Cohésion des territoires
Budget général;Écologie, développement et mobilité durables;P203;Infrastructures et services de transports;852;P203.3;Améliorer la régulation dans les transports routiers et développer la part des modes alternatifs à la route;845;P203.3.3;Contrôle des transports routiers;Citoyen;;23562;Nombre de véhicules de transport routier de marchandises et de voyageurs en infraction rapporté au nombre de véhicules contrôlés en bord de route;%;17;18,5;17;18;18;2020;19;MIN23;Transition écologique et solidaire
Comptes de concours financiers;Avances à l'audiovisuel public;P844;France Médias Monde;12370;P844.3;Assurer la maîtrise de la masse salariale et optimiser la gestion;14478;P844.3.2;Ressources propres;Contribuable;;14911;Ressources propres;M€;8,2;8,2;n.d.;8.2;n.d.;2020;n.d.;MIN07;Action et comptes publics
Comptes d'affectation spéciale;Financement des aides aux collectivités pour l'électrification rurale;P794;Opérations de maîtrise de la demande d'électricité, de production d'électricité par des énergies renouvelables ou de production de proximité dans les zones non interconnectées;11572;P794.1;Contribuer à l'électrification des sites isolés dans les zones non desservies par les réseaux d'électricité;13202;P794.1.1;Sites isolés ayant bénéficié d'une desserte en électricité en métropole;Citoyen;;23188;Coût moyen d'un financement de site isolé en métropole;€;50 447;58 527;30 000;40000;40000;2020;30000;MIN23;Transition écologique et solidaire
Budget général;Enseignement scolaire;P140;Enseignement scolaire public du premier degré;314;P140.2;Promouvoir un aménagement équilibré du territoire éducatif en optimisant les moyens alloués;309;P140.2.2;Écarts de taux d'encadrement à l'école primaire entre éducation prioritaire (EP) et hors EP et proportion d'enseignants avec 5 ans et plus d'ancienneté en EP;Citoyen;;309;écart entre REP+ et hors REP+/REP;élèves par classe;-1,56;-3,07;-3,7;-5;-5.3;2020;-5.5;MIN06;Éducation nationale
Budget général;Enseignement scolaire;P230;Vie de l'élève;11408;P230.1;Faire respecter l'école, améliorer le climat scolaire et favoriser l'apprentissage de la responsabilité et de la citoyenneté;352;P230.1.3;"Taux de participation des lycéens aux élections des ""Conseils des délégués pour la vie lycéenne"" (CVL)";Citoyen;;3996;b) en LP;%;49,3;45,6;51;48;50;2020;53;MIN06;Éducation nationale
Budget général;Gestion des finances publiques et des ressources humaines;P148;Fonction publique;269;P148.1;Développer et promouvoir l'adaptation des règles actuelles aux exigences d'une gestion modernisée des ressources humaines de la fonction publique;11872;P148.1.2;Nombre de corps de fonctionnaires relevant de l'Etat ou des établissements publics administratifs après des mesures de fusion ou de mise en extinction - ou par un alignement sur des dispositions statutaires communes;Usager;;25000;Part des corps de fonctionnaires de l'Etat régis par des dispositions statutaires et indiciaires harmonisées;%;42;62;>=62;63;>=63;2020;>=62;MIN07;Action et comptes publics
Budget général;Action extérieure de l'État;P151;Français à l'étranger et affaires consulaires;30;P151.1;Assurer un service consulaire de qualité;2484;P151.1.1;Délais de traitement des documents administratifs et des demandes de titres;Usager;;13390;5. Visas court séjour;Jour;4,2;4,3;2,9;4;3.5;2020;2.5;MIN01;Europe et affaires étrangères
Budget général;Enseignement scolaire;P141;Enseignement scolaire public du second degré;325;P141.1;Conduire le maximum de jeunes aux niveaux de compétences attendues en fin de formation initiale et à l'obtention des diplômes correspondants;12648;P141.1.6;Proportion d'élèves entrant en 3ème avec au moins un an de retard;Citoyen;;24111;Total REP+;%;31,5;29,3;26;27;25;2020;24;MIN06;Éducation nationale
Budget général;Agriculture, alimentation, forêt et affaires rurales;P215;Conduite et pilotage des politiques de l'agriculture;92;P215.3;Mettre en oeuvre les actions ministérielles dans des conditions optimales de coût et de qualité de service;11755;P215.3.3;Efficience de la fonction informatique;Contribuable;;24001;Taux d'écart budgétaire agrégé des projets informatiques;%;29,6;29,10;26,92;20.92;20;2020;25;MIN03;Agriculture et alimentation
Budget général;Gestion des finances publiques et des ressources humaines;P148;Fonction publique;271;P148.2;Optimiser la formation initiale des fonctionnaires;271;P148.2.1;Dépenses consacrées à la formation initiale dans les IRA et à l'ENA;Contribuable;;10367;Coût complet annuel d'un élève ENA;€;83 654;81 571;82 493;83211;84104;2020;83674;MIN07;Action et comptes publics
Budget général;Gestion des finances publiques et des ressources humaines;P156;Gestion fiscale et financière de l'État et du secteur public local;11663;P156.2;Renforcer la qualité de service au profit des usagers et des partenaires;13350;P156.2.4;Rapidité et qualité de la transmission des informations aux usagers;Usager;;24946;Indice de satisfaction des applications informatiques évaluées par les usagers;Note sur 10;ND;ND;7;7;7;2020;7;MIN07;Action et comptes publics
Budget général;Recherche et enseignement supérieur;P193;Recherche spatiale;648;P193.2;Garantir à la France et à l'Europe un accès à l'espace libre, compétitif et fiable;646;P193.2.1;Part du marché « ouvert » des lancements de satellites prise par Arianespace;Citoyen;;8009;Part du marché « ouvert » des lancements de satellites prise par Arianespace.;%;65;47;*;*;*;2020;>= 50;MIN38;Enseignement supérieur, recherche et innovation
Budget général;Justice;P166;Justice judiciaire;473;P166.1;Améliorer la qualité et l'efficacité de la justice;473;P166.1.1;Délai moyen de traitement des procédures civiles, hors procédures courtes;Usager;;2621;Conseils de prud'hommes;Mois;17;17,3;16,7;17;16;2020;15;MIN10;Justice
Budget général;Enseignement scolaire;;;12228;MEC.2;Conduire le maximum de jeunes aux niveaux de compétences attendues en fin de formation initiale et à l'obtention des diplômes correspondants;14216;MEC.2.2;Taux d'accès au baccalauréat (champs public et privé);Citoyen;Stratégique mission;23290;Taux d'accès au baccalauréat des garçons;%;73,9;74,4;s.o.;s.o.;s.o.;2020;s.o.;;
Budget général;Direction de l'action du Gouvernement;P308;Protection des droits et libertés;3599;P308.1;Défendre et protéger efficacement les droits et les libertés;14297;P308.1.4;Taux d'effectivité du suivi des prises de position des AAI;Citoyen;;23362;Taux de résolution amiable des réclamations;%;78,5;78,6;80;80;80;2020;80;MIN12;Services du Premier ministre
Budget général;Sécurités;P207;Sécurité et éducation routières;831;P207.1;Mobiliser l'ensemble de la société sur la sécurité routière pour réduire le nombre d'accidents et de tués sur les routes;832;P207.1.1;Nombre annuel des tués (France métropolitaine et départements d'outre-mer);Citoyen;;15831;Nombre annuel des tués (France métropolitaine);Nombre;3 477;3 448;en baisse;en baisse;en baisse;2020;en baisse;MIN09;Intérieur
Budget général;Enseignement scolaire;P141;Enseignement scolaire public du second degré;345;P141.3;Promouvoir un aménagement équilibré du territoire éducatif en optimisant les moyens alloués;2550;P141.3.4;Pourcentage d'heures d'enseignement délivrées devant des groupes de dix élèves ou moins;Contribuable;;3366;LP;%;18,9;20,4;s.o;s.o;s.o;2020;s.o;MIN06;Éducation nationale
Budget général;Écologie, développement et mobilité durables;P113;Paysages, eau et biodiversité;10812;P113.2;Préserver et restaurer la biodiversité;11823;P113.2.2;Effort de protection des espaces naturels terrestres et maritimes;Citoyen;;23515;Pourcentage des eaux sous juridiction, incluses dans le réseau national d'aires marines protégées;%;22,36;22,36;30;22.36;32;2020;30;MIN23;Transition écologique et solidaire
Budget général;Investissements d'avenir;P423;Accélération de la modernisation des entreprises;12504;P423.1;Accélérer la croissance des PME et des ETI;14760;P423.1.1;Taux de pérennité des entreprises soutenues;Citoyen;;24806;Ecart entre le taux de pérennité à 3 ans des entreprises soutenues et le taux de pérennité à 3 ans des entreprises créées en France;Points;SO;28,7;supérieur ou égal à 10;22.4;supérieur ou égal à 15;2020;supérieur ou égal à 15;MIN12;Services du Premier ministre
Comptes de concours financiers;Avances à l'audiovisuel public;P841;France Télévisions;3380;P841.1;Proposer une offre de service public, axée sur la création française et européenne dans un univers de média global;3997;P841.1.1;Part des dépenses de programmes dans les dépenses totales;Citoyen;;8354;Part des dépenses de programmes dans les dépenses totales;%;81,6;81,9;n.d.;81.4;n.d.;2020;n.d.;MIN07;Action et comptes publics
Budget général;Enseignement scolaire;P141;Enseignement scolaire public du second degré;325;P141.1;Conduire le maximum de jeunes aux niveaux de compétences attendues en fin de formation initiale et à l'obtention des diplômes correspondants;14691;P141.1.1;"Proportion d'élèves maîtrisant, en fin de sixième, les principales composantes du domaine 1 ""les langages pour penser et communiquer"" du socle commun";Citoyen;;24562;Comprendre, s'exprimer en utilisant la langue française à l'oral et à l'écrit (domaine 1) - en REP;%;s.o.;s.o;77;77;s.o;2020;s.o;MIN06;Éducation nationale
Budget général;Défense;P212;Soutien de la politique de la défense;12107;P212.1;Réussir la transformation du ministère et garantir les grands équilibres portés par la LPM;14455;P212.1.2;Performance des leviers de départs aidés rapportée aux volumes de départs;Usager;;25086;Ouvriers d'Etat / IDV;Nombre;;;108;108;98;2020;98;MIN70;Armées
Budget général;Justice;;;473;MJA.1 (P166.1);Améliorer la qualité et l'efficacité de la justice;473;P166.1.1;Délai moyen de traitement des procédures civiles, hors procédures courtes;Usager;Stratégique mission;2619;Tribunaux d'instance (dont justice de proximité);Mois;5,8;5,9;5,6;5.6;5.3;2020;5;;
Budget général;Conseil et contrôle de l'État;P164;Cour des comptes et autres juridictions financières;438;P164.3;Assister les pouvoirs publics;437;P164.3.2;Nombre d'auditions au Parlement;Citoyen;;20884;Cour des comptes et chambres régionales et territoriales des comptes;Nombre;57;35;35;80;80;2020;80;MIN12;Services du Premier ministre
Comptes de concours financiers;Avances à l'audiovisuel public;P847;TV5 Monde;3403;P847.3;Assurer la maîtrise de la masse salariale et optimiser la gestion;14571;P847.3.2;Maîtrise des charges;Contribuable;;14954;Charges de personnel;M€;32,3;33,2;34,7;33.9;34.7;2020;ND;MIN07;Action et comptes publics
Budget général;Sport, jeunesse et vie associative;P163;Jeunesse et vie associative;2293;P163.2;Soutenir le développement de la vie associative;14016;P163.2.1;Proportion d'associations faiblement dotées en personnel salarié parmi celles ayant bénéficié d'une subvention versée par l'intermédiaire du FONJEP ou au titre du FDVA;Citoyen;;23077;Proportion d'associations faiblement dotées en personnel salarié parmi celles ayant bénéficié d'une subvention versée par l'intermédiaire du Fonds de coopération de la jeunesse et de l'éducation populaire (FONJEP);%;22;21;23;22;23;2020;25;MIN06;Éducation nationale
Budget général;Régimes sociaux et de retraite;P197;Régimes de retraite et de sécurité sociale des marins;11084;P197.1;Optimiser le régime de protection sociale des marins;712;P197.1.1;Coût unitaire d'une primo liquidation de pension retraite;Contribuable;;8480;Coût unitaire d'une primo liquidation de pension retraite;€;783;734;797;735;724;2020;705;MIN23;Transition écologique et solidaire
Budget général;Agriculture, alimentation, forêt et affaires rurales;P215;Conduite et pilotage des politiques de l'agriculture;92;P215.3;Mettre en oeuvre les actions ministérielles dans des conditions optimales de coût et de qualité de service;92;P215.3.2;Efficience de la fonction achat;Contribuable;;24977;Taux de performance achat;%;15;;9;6;7.5;2020;10;MIN03;Agriculture et alimentation
Budget général;Enseignement scolaire;P141;Enseignement scolaire public du second degré;325;P141.1;Conduire le maximum de jeunes aux niveaux de compétences attendues en fin de formation initiale et à l'obtention des diplômes correspondants;329;P141.1.3;Écart de taux de réussite au diplôme national du brevet (DNB) entre éducation prioritaire (EP) et hors EP;Citoyen;;17850;écart entre REP et hors EP;écart entre taux;-7,4;-5,9;-5,5;-5.5;-5;2020;-4.5;MIN06;Éducation nationale
Budget général;Travail et emploi;P103;Accompagnement des mutations économiques et développement de l'emploi;2730;P103.2;Sécuriser l'emploi par l'anticipation des mutations économiques;13486;P103.2.2;Part des entreprises de moins de 50 salariés parmi celles ayant eu recours à l'activité partielle;Citoyen;;22737;Part des entreprises de moins de 50 salariés parmi celles ayant eu recours à l'activité partielle;%;90;92;93;93;94;2020;94;MIN36;Travail
Budget général;Recherche et enseignement supérieur;P142;Enseignement supérieur et recherche agricoles;702;P142.1;Former des ingénieurs, des vétérinaires et des paysagistes répondant aux besoins des milieux économiques, formés aux pratiques de la recherche et ouverts sur l'international;702;P142.1.1;Taux d'insertion des diplômés;Citoyen;;6263;Taux d'insertion des diplômés dans les 24 mois suivant l'obtention du diplôme;%;89,9;95;90,5;95;95;2020;90.5;MIN03;Agriculture et alimentation
Budget général;Recherche et enseignement supérieur;P192;Recherche et enseignement supérieur en matière économique et industrielle;675;P192.2;Optimiser la valorisation de la recherche des organismes de formation supérieure et de recherche;4041;P192.2.1;Part des montants des contrats de recherche et des partenariats sur les ressources des écoles consacrées à la recherche;Contribuable;;18272;3 - Part des contrats de recherche sur financement de l'Union européenne;%;6,2;6,5;7;6.5;6.5;2020;7;MIN21;Économie et finances
Budget général;Travail et emploi;P102;Accès et retour à l'emploi;903;P102.3;Mobiliser au mieux les outils d'insertion professionnelle au bénéfice des personnes les plus éloignées du marché du travail;14814;P102.3.4;Taux de sortie positive vers l'emploi et l'autonomie des jeunes ayant bénéficié de la Garantie jeunes;Citoyen;;24922;Taux de sortie positive vers l'emploi et l'autonomie des jeunes ayant bénéficié de la Garantie jeunes;%;55;64;58;69;70;2020;72;MIN36;Travail
Comptes d'affectation spéciale;Pensions;P742;Ouvriers des établissements industriels de l'État;3567;P742.2;Optimiser le taux de recouvrement;4332;P742.2.1;Taux de récupération des indus et trop-versés;Contribuable;;6160;FSPOEIE : taux de récupération des indus et trop-versés;%;85,7;87,8;90;90;90;2020;90;MIN07;Action et comptes publics
Budget général;Cohésion des territoires;P109;Aide à l'accès au logement;998;P109.1;Aider les ménages modestes à faire face à leurs dépenses de logement;2889;P109.1.1;Taux d'effort net médian des ménages en locatif ordinaire ou en accession selon la configuration familiale et le type de parc;Citoyen;;25064;Familles monoparentales avec 3 enfants;%;8,5;8,5;8,5;8.5;8.5;2020;8.5;MIN45;Cohésion des territoires
Budget général;Écologie, développement et mobilité durables;P205;Affaires maritimes;861;P205.2;Promouvoir la flotte de commerce et l'emploi maritime;861;P205.2.1;Taux des actifs maritimes (employés dans les domaines maritime et para-maritime) parmi les anciens élèves des établissements d'enseignement maritime 3 ans après l'obtention de leur diplôme de formation initiale;Usager;;3422;Taux d'actifs maritimes parmi les élèves sortis de l'ENSM;%;79,9;77,1;90;85;85;2020;90;MIN23;Transition écologique et solidaire
Budget général;Recherche et enseignement supérieur;P190;Recherche dans les domaines de l'énergie, du développement et de la mobilité durables;10857;P190.4;Soutenir par la recherche, le développement des nouvelles technologies de l'énergie (NTE) et de l'efficacité énergétique;665;P190.4.1;Mesure des transferts des technologies NTE auprès des industriels à partir des travaux du CEA et de l'IFP EN;Citoyen;;11036;Nombre de brevets IFP EN déposés dans l'année dans le domaine des NTE;Nombre;83;79;85;85;88;2020;90;MIN23;Transition écologique et solidaire
Budget général;Aide publique au développement;P209;Solidarité à l'égard des pays en développement;12575;P209.4;Contrôler l'amélioration de l'efficacité et l'efficience de l'aide;14956;P209.4.3;Frais de gestion;Contribuable;;25841;Frais de gestion sur le canal multilatéral;%;8,4;8;SO;8;8;2020;8;MIN01;Europe et affaires étrangères
Budget général;Cohésion des territoires;;;998;MVA.1 (P109.1);Aider les ménages modestes à faire face à leurs dépenses de logement;2889;P109.1.1;Taux d'effort net médian des ménages en locatif ordinaire ou en accession selon la configuration familiale et le type de parc;Citoyen;Stratégique mission;23397;Total;%;18,8;nd;18,5;18.9;18.9;2020;18.9;;
Budget général;Outre-mer;P138;Emploi outre-mer;541;P138.2;Lutter contre l'exclusion du marché du travail des publics les plus éloignés de l'emploi par des actions de formation professionnelle adaptées;541;P138.2.1;Taux d'insertion des volontaires du SMA en fin de contrat;Citoyen;;8418;Taux d'insertion des volontaires stagiaires du SMA en fin de contrat;%;77;77;78;78;78;2020;78;MIN44;Outre-mer
Budget général;Agriculture, alimentation, forêt et affaires rurales;;;2669;MAC.2 (P206.1);Favoriser le changement de pratiques afin de préserver la santé publique et l'environnement;14414;P206.1.1;Maîtrise de l'utilisation des pesticides et des antibiotiques;Citoyen;Stratégique mission;20919;Niveau de traitement des animaux à la colistine (plan Ecoantibio);%;10,6;6,4;8,5;6.1;5.9;2020;6.4;;
Budget général;Économie;P220;Statistiques et études économiques;813;P220.1;Respecter les engagements de la France par rapport à l'Europe en termes de délais de diffusion des résultats économiques;813;P220.1.1;Nombre de jours de retard cumulés entre les dates de diffusion et les dates prévues dans les engagements européens;Citoyen;;15660;Diffusion des indices économiques conjoncturels;Jours;0;0;0;0;0;2020;0;MIN21;Économie et finances
Budget général;Cohésion des territoires;P147;Politique de la ville;992;P147.2;Améliorer l'encadrement éducatif et les chances de réussite scolaire des élèves les plus en difficulté;3123;P147.2.1;Évolution des chances de réussite scolaire des élèves scolarisés en collège REP+ dans un quartier prioritaire de la politique de la ville (QPV);Citoyen;;4125;écart (a)-(b);points;-11,1;-9,6;-10;-9.5;-9.3;2020;-9.1;MIN45;Cohésion des territoires
Budget général;Cohésion des territoires;P135;Urbanisme, territoires et amélioration de l'habitat;1009;P135.3;Améliorer et adapter la qualité du parc privé;14837;P135.3.1;Performance des dispositifs de l'ANAH traitant des principaux enjeux de l'habitat privé;Usager;;25059;Taux de logements financés par l'ANAH dans le cadre de la lutte contre la précarité énergétique dont le gain énergétique avant/après travaux est supérieur à 40 %;%;SO;SO;44;44;44;2020;46;MIN45;Cohésion des territoires
Budget général;Défense;P212;Soutien de la politique de la défense;12107;P212.1;Réussir la transformation du ministère et garantir les grands équilibres portés par la LPM;14455;P212.1.2;Performance des leviers de départs aidés rapportée aux volumes de départs;Usager;;25087;Ouvriers d'Etat / Taux;%;;;10;9;9;2020;7;MIN70;Armées
Budget général;Régimes sociaux et de retraite;P195;Régimes de retraite des mines, de la SEITA et divers;3060;P195.1;Optimiser la gestion des régimes;3430;P195.1.1;Coût unitaire d'une primo liquidation de pensions (tous droits);Contribuable;;4564;Régime SEITA;€;328,29;332;335,9;337.4;342.1;2020;346.7;MIN07;Action et comptes publics
Budgets annexes;Contrôle et exploitation aériens;P613;Soutien aux prestations de l'aviation civile;2413;P613.2;Maîtriser l'équilibre recettes / dépenses et l'endettement du budget annexe;2489;P613.2.1;Endettement / recettes d'exploitation;Contribuable;;8336;Endettement / recettes d'exploitation;%;52,8;44,9;43,4;43;41;2020;ND;MIN23;Transition écologique et solidaire
Budget général;Justice;P310;Conduite et pilotage de la politique de la justice;528;P310.1;Optimiser la qualité et l'efficience des fonctions de soutien;11795;P310.1.1;Respect des coûts et des délais des grands projets immobiliers;Contribuable;;24038;Taux d'écart calendaire agrégé (immobilier judiciaire);%;30,18;23,89;45,91;49.11;46.72;2020;37.32;MIN10;Justice
Budgets annexes;Contrôle et exploitation aériens;P612;Navigation aérienne;2501;P612.4;Améliorer l'efficacité économique des services de navigation aérienne;2586;P612.4.1;Niveau du taux unitaire des redevances métropolitaines de navigation aérienne;Usager;;15908;Ecart du taux unitaire de route français par rapport au taux unitaire moyen des sept Etats dont l'espace aérien est limitrophe de la France;€;-15,08;-7,60;-13,02;-7.75;-8.96;2020;-;MIN23;Transition écologique et solidaire
Budget général;Action extérieure de l'État;P105;Action de la France en Europe et dans le monde;12;P105.3;Assurer un service diplomatique efficient et de qualité;12248;P105.3.3;Efficience de la gestion immobilière;Contribuable;;17893;1. Ratio SUN / Poste de Travail;m²/poste;14,7;14,8;15;15;14.8;2020;14.1;MIN01;Europe et affaires étrangères
Budget général;Défense;P212;Soutien de la politique de la défense;12107;P212.1;Réussir la transformation du ministère et garantir les grands équilibres portés par la LPM;14455;P212.1.2;Performance des leviers de départs aidés rapportée aux volumes de départs;Usager;;25082;Personnel civil / Taux;%;;;3;2;2;2020;2;MIN70;Armées
Comptes de concours financiers;Avances à l'audiovisuel public;P841;France Télévisions;3380;P841.1;Proposer une offre de service public, axée sur la création française et européenne dans un univers de média global;14826;P841.1.2;Qualité des programmes de fiction et d'information;Citoyen;;25013;Qualité des programmes d'information;Note sur 10;6,3;6,4;n.d.;n.d.;n.d.;2020;n.d.;MIN07;Action et comptes publics
Budget général;Conseil et contrôle de l'État;P126;Conseil économique, social et environnemental;131;P126.1;Associer les principales organisations de la société civile à l'élaboration de la politique économique sociale et environnementale de la Nation;3330;P126.1.2;Activités partenariales;Citoyen;;19909;Nombre de colloques et évènements institutionnels organisés par le CESE ou en partenariat;nombre;180;230;200;200;190;2020;200;MIN12;Services du Premier ministre
Budget général;Justice;P166;Justice judiciaire;483;P166.2;Rendre plus efficaces la réponse pénale, l'exécution et l'aménagement des peines;483;P166.2.1;Taux d'alternatives aux poursuites (TGI);Citoyen;;3823;Avec les mesures de rappel à la loi;%;42;41;43,5;42;43;2020;45;MIN10;Justice
