Type de Mission;Mission;COD_PGM;Programme;Identifiant Objectif;Numéro Objectif;Objectif;Identifiant Indicateur;Numéro indicateur;Indicateur;type indicateur;Stratégique au niveau mission?;Identifiant sous indicateur;Sous-indicateur;Unité;Réalisation 2016;Réalisation 2017;Prévision 2018 PAP 2018;Prévision 2018 PAP 2019;Prévision 2019 PAP 2019;Année cible;Valeur cible;Code Ministère;Ministère
Budget général;Direction de l'action du Gouvernement;P129;Coordination du travail gouvernemental;10082;P129.1;Favoriser l'adoption, dans les meilleurs délais, des décrets d'application des lois et des mesures de transposition des directives européennes;11703;P129.1.2;Taux de déficit de transposition des directives européennes;Citoyen;;15682;Taux de déficit de transposition des directives européennes;%;1,1;0,4;1;A renseigner le 10 décembre 2018;1;2020;1;MIN12;Services du Premier ministre
Budget général;Cohésion des territoires;;;996;MVA.4 (P147.3);Lutter contre les concentrations de pauvreté et favoriser l'accès et le retour à l'emploi des habitants des QPV;14334;P147.3.1;Écart de revenu et d'emploi entre les QPV et celui des agglomérations environnantes;Usager;Stratégique mission;25011;Écart entre le taux de chômage des QPV et celui de leurs agglomérations;Points;15,4;15,5;13,2;15.4;15.2;2020;10.8;;
Budget général;Action extérieure de l'État;P185;Diplomatie culturelle et d'influence;12593;P185.3;Accroître la performance du dispositif d'aide à l'export;15007;P185.3.1;Accompagnement des acteurs économiques;Citoyen;;25910;Nombre de résultats obtenus (nombre de contrats signés toutes catégories confondues + nombre de changements favorables) / nombre d'entreprises reçues par les postes;%;N/A;16;10;10;12;2020;15;MIN01;Europe et affaires étrangères
Budget général;Cohésion des territoires;;;998;MVA.1 (P109.1);Aider les ménages modestes à faire face à leurs dépenses de logement;2889;P109.1.1;Taux d'effort net médian des ménages en locatif ordinaire ou en accession selon la configuration familiale et le type de parc;Citoyen;Stratégique mission;25064;Familles monoparentales avec 3 enfants;%;8,5;8,5;8,5;8.5;8.5;2020;8.5;;
Budget général;Sécurités;;;12432;MSB.1;(P176.1/P152.1) Évaluer objectivement la prévention de la délinquance;14575;MSB.1.1;Evolution du nombre de crimes et délits et de victimes en matière d'atteintes volontaires à l'intégrité physique (AVIP) constatés;Citoyen;Stratégique mission;24061;Nombre de victimes de violences physiques non crapuleuses et violences sexuelles;Nombre;352 262;356 735;Suivi;Suivi;Suivi;2020;Suivi;;
Budget général;Administration générale et territoriale de l'État;P216;Conduite et pilotage des politiques de l'intérieur;59;P216.2;Améliorer la performance des fonctions supports;11988;P216.2.3;Efficience immobilière;Contribuable;;17284;Ratio SUN / Poste de travail;m² / poste;8,61;8,55;8,29;8.74;8.38;2020;8.2;MIN09;Intérieur
Budget général;Agriculture, alimentation, forêt et affaires rurales;P215;Conduite et pilotage des politiques de l'agriculture;92;P215.3;Mettre en oeuvre les actions ministérielles dans des conditions optimales de coût et de qualité de service;4347;P215.3.1;Efficience de la fonction immobilière;Contribuable;;23999;Taux d'écart budgétaire agrégé des projets d'infrastructure;%;11;2,61;3;1.78;1;2020;2018-05-10T00:00:00;MIN03;Agriculture et alimentation
Budget général;Direction de l'action du Gouvernement;;;3581;MDC.2 (P129.5);Améliorer la sécurité et la performance des systèmes d'information de l'État;4372;P129.5.1;Niveau de sécurité des systèmes d'information de l'État;Usager;Stratégique mission;7842;Maturité globale en sécurité des systèmes d'information de l'État;note de 0 à 5;2,5;2,7;3;2.7;2.8;2020;3.5;;
Budget général;Travail et emploi;P111;Amélioration de la qualité de l'emploi et des relations du travail;968;P111.4;Lutter efficacement contre le travail illégal et la fraude au détachement;11055;P111.4.1;Part des interventions des services de l'inspection du travail en matière de lutte contre le travail illégal;Contribuable;;25707;Part des interventions des services de l'inspection du travail portant sur la lutte contre le travail illégal ayant donné lieu à procès-verbal, sur l'ensemble des interventions portant sur la lutte contre le travail illégal;%;SO;SO;SO;1.5;2;2020;2.5;MIN36;Travail
Budget général;Action extérieure de l'État;P185;Diplomatie culturelle et d'influence;12593;P185.3;Accroître la performance du dispositif d'aide à l'export;15007;P185.3.1;Accompagnement des acteurs économiques;Citoyen;;25911;Nombre de changements favorables aux intérêts français obtenus suite à une démarche de l'Ambassade;Nombre;641;1 099;700;700;750;2020;800;MIN01;Europe et affaires étrangères
Budget général;Action et transformation publiques;P348;Rénovation des cités administratives et autres sites domaniaux multi-occupants;12567;P348.1;Optimiser le parc immobilier;14883;P348.1.1;Performance énergétique;Contribuable;;25401;Performance énergétique;Kwh/m²;SO;SO;100;100;ND;2020;ND;MIN07;Action et comptes publics
Budget général;Agriculture, alimentation, forêt et affaires rurales;;;74;MAC.1 (P149.1);Combiner la performance économique et environnementale des exploitations agricoles, des filières agroalimentaires et forestières;14840;P149.1.1;Concours publics à l'agriculture / Excédent brut d'exploitation des entreprises agricoles;Contribuable;Stratégique mission;25094;Concours publics à l'agriculture / Excédent brut d'exploitation des entreprises agricoles;%;30,74;28,5;28,18;27.83;28.24;2020;27.45;;
Budget général;Écologie, développement et mobilité durables;P217;Conduite et pilotage des politiques de l'écologie, du développement et de la mobilité durables;10728;P217.1;Être une administration exemplaire, au regard du développement durable, dans la maîtrise des moyens de fonctionnement;11846;P217.1.2;Efficience de la gestion immobilière;Contribuable;;18551;Ratio d'occupation (SUN / poste de travail) en administration centrale;m² / poste;12,8;11,7;11,9;11.7;11.7;2020;11.7;MIN23;Transition écologique et solidaire
Comptes de concours financiers;Avances à l'audiovisuel public;P843;Radio France;3626;P843.1;Proposer une offre radiophonique de service public, axée sur la culture, dans un univers de média global;10230;P843.1.1;Proposer une offre radiophonique et culturelle de service public;Citoyen;;10433;France Inter : part de nouveautés parmi les titres diffusés;%;49;54,5;>=50;>=50;>=50;2020;ND;MIN07;Action et comptes publics
Comptes de concours financiers;Avances à l'audiovisuel public;;;11143;MZD.2 (P843.2);S'adresser au public le plus large dans un environnement numérique;4525;P843.2.1;Audience des antennes de Radio France;Citoyen;Stratégique mission;6393;- France Inter;%;10,9;11,3;10,3;10.3;10.4;2020;ND;;
Budget général;Médias, livre et industries culturelles;;;11186;MMA.2 (P334.1);Favoriser l'accès du public aux bibliothèques et le développement de la lecture;12337;P334.1.1;Fréquentation des bibliothèques;Citoyen;Stratégique mission;18003;Bpi;Nombre;1 260 889;1 369 262;1 350 000;1350000;1200000;2020;1200000;;
Budget général;Sécurités;;;12432;MSB.1;(P176.1/P152.1) Évaluer objectivement la prévention de la délinquance;14576;MSB.1.2;Evolution du nombre de crimes et délits en matière d'atteintes aux biens (AAB) constatés;Citoyen;Stratégique mission;24065;Nombre de cambriolages;Nombre;390 828;390 274;En baisse;En baisse;En baisse;2020;En baisse;;
Budget général;Engagements financiers de l'État;P117;Charge de la dette et trésorerie de l'État (crédits évaluatifs);292;P117.4;Obtenir un niveau de contrôle des risques de qualité constante et qui minimise la survenance d'incidents;291;P117.4.1;Qualité du système de contrôle;Citoyen;;2609;Notation externe du contrôle interne : Système de mesure des risques et des résultats;Note entre 1 et 4;1;1;1;1;1;2020;1;MIN21;Économie et finances
Budget général;Justice;P182;Protection judiciaire de la jeunesse;506;P182.2;Optimiser l'emploi des moyens humains, financiers et matériels;510;P182.2.2;Prix des mesures judiciaires par journée;Contribuable;;12360;Prix d'une journée en établissement de placement éducatif EPE-UEHC (secteur public et secteur associatif habilité);€;557;560;606;561;569;2020;NC;MIN10;Justice
Budget général;Solidarité, insertion et égalité des chances;P124;Conduite et soutien des politiques sanitaires, sociales, du sport, de la jeunesse et de la vie associative;10895;P124.1;Faire de la Gestion des Ressources Humaines (GRH) un levier de performance;11891;P124.1.1;Ratio d'efficience de la gestion des ressources humaines;Contribuable;;20925;Pour information : effectifs gérés;nombre;19 112;18 893;n.d.;n.d.;n.d.;2020;n.d.;MIN56;Solidarités et santé
Budget général;Travail et emploi;P102;Accès et retour à l'emploi;903;P102.3;Mobiliser au mieux les outils d'insertion professionnelle au bénéfice des personnes les plus éloignées du marché du travail;4797;P102.3.2;Taux d'insertion dans l'emploi à la sortie des structures d'insertion par l'activité économique;Citoyen;;16589;Taux d'insertion dans l'emploi à la sortie d'une association intermédiaire (AI);%;35,8;36,1;37;nd;37.5;2020;38;MIN36;Travail
Budget général;Gestion des finances publiques et des ressources humaines;P156;Gestion fiscale et financière de l'État et du secteur public local;11661;P156.1;Améliorer l'efficacité du recouvrement, de la lutte contre la fraude fiscale et du traitement des dépenses publiques;13345;P156.1.1;Taux de déclaration et de recouvrement spontanés (civisme);Citoyen;;25724;Taux brut de recouvrement des prélèvements sur les revenus de 2019 des particuliers en mode PAS (prélèvement à la source);%;SO;SO;SO;SO;97.8;2020;98.3;MIN07;Action et comptes publics
Budget général;Enseignement scolaire;P140;Enseignement scolaire public du premier degré;305;P140.1;Conduire tous les élèves à la maîtrise des connaissances et compétences du socle commun exigibles au terme de la scolarité primaire;10089;P140.1.1;"Proportion d'élèves maîtrisant, en fin de CE2, les principales composantes du domaine 1 ""les langages pour penser et communiquer"" du socle commun";Citoyen;;15778;Comprendre, s'exprimer en utilisant la langue française à l'oral et à l'écrit (domaine 1) - total;%;nd;79,1;so;so;so;2020;89;MIN06;Éducation nationale
Budget général;Action extérieure de l'État;P185;Diplomatie culturelle et d'influence;20;P185.4;Dynamiser les ressources externes;11369;P185.4.1;Autofinancement et partenariats;Contribuable;;5178;Taux d'autofinancement des établissements à autonomie financière pluridisciplinaires hors personnel MEAE;%;69;72;67;69;69;2020;69;MIN01;Europe et affaires étrangères
Budget général;Justice;P107;Administration pénitentiaire;498;P107.1;Favoriser la réinsertion;494;P107.1.1;Pourcentage de personnes placées sous écrou et condamnées bénéficiant d'un aménagement de peine ou d'une libération sous contrainte;Citoyen;;24571;Indicateur de contexte : pourcentage de PE dans le nombre total d'aménagements de peines sous écrou (PSE, PE et SL);%;7,1;7,3;8;7;8.5;2020;9;MIN10;Justice
Budget général;Enseignement scolaire;P140;Enseignement scolaire public du premier degré;305;P140.1;Conduire tous les élèves à la maîtrise des connaissances et compétences du socle commun exigibles au terme de la scolarité primaire;2404;P140.1.2;Proportion d'élèves entrant en sixième avec au moins un an de retard;Citoyen;;8052;Retard à l'entrée en 6ème - total;%;10,1;8,7;7;7.5;7;2020;6;MIN06;Éducation nationale
Budget général;Sport, jeunesse et vie associative;;;2289;MSF.3 (P163.1);Favoriser l'engagement et la mobilité de tous les jeunes;12357;P163.1.1;Part des jeunes considérés comme éloignés parmi les jeunes engagés dans une mission de service civique;Citoyen;Stratégique mission;25755;Part des jeunes résidant dans les quartiers politiques de la ville en mission de service civique au cours d'une année n;%;13,3;13;SO;;15;2020;15;;
Budgets annexes;Publications officielles et information administrative;P624;Pilotage et ressources humaines;10940;P624.2;Rationaliser l'occupation du parc immobilier;11966;P624.2.1;Efficience de la gestion immobilière;Contribuable;;16540;Ratio Entretien courant / SUB;€;17,65;14,61;16,72;16.72;16.44;2020;15.92;MIN12;Services du Premier ministre
Budget général;Solidarité, insertion et égalité des chances;P124;Conduite et soutien des politiques sanitaires, sociales, du sport, de la jeunesse et de la vie associative;10895;P124.1;Faire de la Gestion des Ressources Humaines (GRH) un levier de performance;11891;P124.1.1;Ratio d'efficience de la gestion des ressources humaines;Contribuable;;16001;Ratio d'efficience de la gestion des ressources humaines;%;3,3;3,46;3,1;3.1;3.1;2020;3.1;MIN56;Solidarités et santé
Budget général;Solidarité, insertion et égalité des chances;P124;Conduite et soutien des politiques sanitaires, sociales, du sport, de la jeunesse et de la vie associative;10898;P124.2;Accroître l'efficience de la gestion des moyens;14590;P124.2.4;Respect des coûts et délais des grands projets;Contribuable;;24088;Immobilier : Taux d'écart budgétaire agrégé;%;s.o.;s.o.;s.o.;s.o.;s.o.;2020;s.o.;MIN56;Solidarités et santé
Budget général;Médias, livre et industries culturelles;P334;Livre et industries culturelles;11187;P334.2;Soutenir la création et la diffusion du livre;11905;P334.2.2;Part de marché des librairies indépendantes;Citoyen;;16495;Part de marché des librairies indépendantes;%;18,5;18,5;18;18;18;2020;18;MIN02;Culture
Budget général;Administration générale et territoriale de l'État;;;45;MAB.2 (P307.2);Optimiser les conditions de délivrance de titres fiables et l'efficacité des services de délivrance de titres;11297;P307.2.2;Délais moyens de délivrance des titres;Usager;Stratégique mission;24976;Pourcentage de cartes nationales d'identité mises à disposition dans un délai de 15 jours;%;SO;SO;85;78;80;2020;82;;
Budget général;Santé;;;12492;MSA.1;Améliorer l'état de santé de la population et réduire les inégalités territoriales et sociales de santé;14824;MSA.1.2;Espérance de vie;Citoyen;Stratégique mission;25004;Espérance de vie en bonne santé à 65 ans;;;;;;;2020;;;
Budget général;Gestion des finances publiques et des ressources humaines;P218;Conduite et pilotage des politiques économiques et financières;449;P218.3;Maîtriser le coût des fonctions support;11928;P218.3.5;Efficience de la gestion immobilière;Contribuable;;16340;Ratio entretien courant / SUB;€ / m2;36,8;37,4;37,4;37.4;37.4;2020;37.4;MIN07;Action et comptes publics
Budget général;Sport, jeunesse et vie associative;;;775;MSF.1 (P219.1);Réduire les inégalités d'accès à la pratique sportive;775;P219.1.1;Pratique sportive des publics prioritaires;Usager;Stratégique mission;16441;Pour information : Taux de licences au plan national;%;24,3;24,5;S.O.;S.O.;S.O.;2020;S.O.;;
Budget général;Action extérieure de l'État;P151;Français à l'étranger et affaires consulaires;30;P151.1;Assurer un service consulaire de qualité;14966;P151.1.3;Dématérialisation des services consulaires;Citoyen;;25866;Taux de dématérialisation des demandes d'inscription au Registre des Français à l'étranger;%;SO;39;SO;40;42;2020;45;MIN01;Europe et affaires étrangères
Budget général;Écologie, développement et mobilité durables;P159;Expertise, information géographique et météorologie;582;P159.4;Météo-France : disposer d'un système performant de prévision météorologique et d'avertissement des risques météorologiques;14816;P159.4.1;Performance des modèles de prévision numérique du temps et de la procédure de vigilance météorologique;Usager;;24959;Fiabilité de la prévision numérique du modèle à maille fine AROME (modifié);%;77,9;79,3;>78,5;>78,5;>79;2020;>79;MIN23;Transition écologique et solidaire
Budgets annexes;Contrôle et exploitation aériens;P614;Transports aériens, surveillance et certification;2505;P614.1;Concourir à la sécurité et à la sûreté de l'aviation civile;2600;P614.1.2;Nombre de contrôles ciblés d'aéronefs étrangers sur les aéroports français effectués annuellement rapporté au nombre total de contrôles;Citoyen;;7294;Pourcentage de contrôles ciblés;%;29;31;35;35;35;2020;35;MIN23;Transition écologique et solidaire
Budget général;Justice;P335;Conseil supérieur de la magistrature;11509;P335.1;Contribuer à la continuité du fonctionnement de l'institution judiciaire;12856;P335.1.1;Délai utile d'examen des propositions de nomination du garde des Sceaux;Usager;;20062;Propositions CSM siège;jour;44;35;60;50;55;2020;55;MIN10;Justice
Budget général;Médias, livre et industries culturelles;P180;Presse et médias;3582;P180.3;Améliorer le ciblage et l'efficacité des dispositifs d'aide;4376;P180.3.2;Part de l'aide publique globale accordée à la presse d'information politique et générale;Contribuable;;8467;"Aides directes aux éditeurs de presse (programme ""Presse et médias"")";%;99,1;94,2;96,9;95.2;95.2;2020;99;MIN02;Culture
Budget général;Sécurités;P207;Sécurité et éducation routières;831;P207.1;Mobiliser l'ensemble de la société sur la sécurité routière pour réduire le nombre d'accidents et de tués sur les routes;832;P207.1.1;Nombre annuel des tués (France métropolitaine et départements d'outre-mer);Citoyen;;24575;Nombre de tués parmi les jeunes conducteurs (moins de 2 ans de permis);Nombre;325;N.D.;en baisse;en baisse;en baisse;2020;en baisse;MIN09;Intérieur
Budget général;Aide publique au développement;P209;Solidarité à l'égard des pays en développement;12573;P209.1;Contribuer à la mise en oeuvre des ODD, en renforçant la composante bilatérale et en concentrant l'aide sur les pays prioritaires;14947;P209.1.2;Part des crédits multilatéraux du programme et des taxes dédiés aux priorités sectorielles du CICID;Citoyen;;25832;Part des crédits multilatéraux pour l'éducation;%;2,9;3,7;SO;5.6;6;2020;7;MIN01;Europe et affaires étrangères
Budget général;Cohésion des territoires;P162;Interventions territoriales de l'État;2395;P162.3;Préserver la biodiversité, les habitats et le caractère de zone humide du Marais poitevin;2468;P162.3.1;Evolution de la surface des prairies dans la zone du Marais poitevin par rapport à celle constatée dans les départements couvrant la zone;Citoyen;;15392;Pourcentage de prairies dans la zone du Marais poitevin protégées par le biais d'une contractualisation au titre des mesures agro-environnementales;%;81;81;86;ND;ND;2020;ND;MIN12;Services du Premier ministre
Budget général;Administration générale et territoriale de l'État;P232;Vie politique, cultuelle et associative;2003;P232.1;Organiser les élections au meilleur coût;2003;P232.1.1;Coût moyen de l'élection par électeur inscrit sur les listes électorales;Contribuable;;3284;1.1.4 - Européennes 2019;€/électeur inscrit;s.o.;s.o.;s.o.;s.o.;2.67;2020;s.o.;MIN09;Intérieur
Budget général;Administration générale et territoriale de l'État;P307;Administration territoriale;46;P307.3;Moderniser et rationaliser le contrôle de légalité et le contrôle budgétaire;46;P307.3.1;Taux de contrôle des actes des collectivités locales et établissements publics;Citoyen;;24633;Taux de contrôle des actes budgétaires des collectivités locales et établissements publics;%;58;57;65;60;62;2020;65;MIN09;Intérieur
Budget général;Culture;P224;Transmission des savoirs et démocratisation de la culture;154;P224.1;Améliorer l'insertion professionnelle des diplômés de l'enseignement supérieur;154;P224.1.1;Taux d'insertion professionnelle des diplômés de l'enseignement supérieur Culture;Citoyen;;16940;Arts Plastiques;%;61,81;63.30;61;64;65;2020;66;MIN02;Culture
Budget général;Recherche et enseignement supérieur;P231;Vie étudiante;613;P231.1;Contribuer à promouvoir l'égalité des chances pour l'accès aux formations de l'enseignement supérieur des différentes classes sociales;612;P231.1.2;Evolution de la représentation des origines socio-professionnelles des étudiants selon le niveau de formation;Citoyen;;2736;"Equivalent ""M"" Ouvriers,employés";%;20;20,4;20,1;21;21.5;2020;>=22;MIN38;Enseignement supérieur, recherche et innovation
Budget général;Enseignement scolaire;P140;Enseignement scolaire public du premier degré;314;P140.2;Promouvoir un aménagement équilibré du territoire éducatif en optimisant les moyens alloués;309;P140.2.2;Écarts de taux d'encadrement à l'école primaire entre éducation prioritaire (EP) et hors EP et proportion d'enseignants avec 5 ans et plus d'ancienneté en EP;Citoyen;;24118;Proportion d'enseignants avec 5 ans et plus d'ancienneté dans une école en éducation prioritaire;%;35,1;33,8;39;36;38;2020;40;MIN06;Éducation nationale
Budget général;Recherche et enseignement supérieur;P190;Recherche dans les domaines de l'énergie, du développement et de la mobilité durables;682;P190.2;Développer les recherches partenariales entre acteurs publics et entre acteurs publics et privés et valoriser les résultats de la recherche;683;P190.2.1;Part des contrats passés avec les industriels et les partenaires dans les ressources des instituts de recherche;Contribuable;;19802;Taux de participation des industriels et des partenaires au financement des recherches sur les nouvelles technologies de l'énergie (IFP EN);%;9,6;8,8;8,1;8.4;8.7;2020;8.9;MIN23;Transition écologique et solidaire
Budget général;Agriculture, alimentation, forêt et affaires rurales;P149;Compétitivité et durabilité de l'agriculture, de l'agroalimentaire, de la forêt, de la pêche et de l'aquaculture;81;P149.3;Renforcer la qualité du service et maîtriser les coûts de gestion des politiques publiques;79;P149.3.1;Coût de gestion des aides PAC;Contribuable;;8319;Coût de mise en oeuvre des aides du 1er pilier et des aides surfaces du 2nd pilier / montant des soutiens 1er pilier et aides surfaces 2nd pilier reçus.;%;2,72;ND;3,1;ND;ND;2020;2.8;MIN03;Agriculture et alimentation
Budget général;Sécurités;P176;Police nationale;2197;P176.4;Renforcer l'efficacité dans la lutte contre l'insécurité routière;2196;P176.4.2;Indice d'efficacité du dépistage d'alcoolémie sur les accidents corporels dus à l'alcool;Citoyen;;17732;Indice d'efficacité du dépistage d'alcoolémie sur les accidents corporels dus à l'alcool;indice;0,99;1,08;>1;>1;>1;2020;>1;MIN09;Intérieur
Budget général;Enseignement scolaire;P143;Enseignement technique agricole;404;P143.1;Assurer un enseignement général, technologique et professionnel conduisant à la réussite scolaire et à une bonne insertion sociale et professionnelle;405;P143.1.2;Taux d'insertion professionnelle;Citoyen;;17865;Insertion à 33 mois CAPA;%;ND;(*);68;(*);(*);2020;71;MIN03;Agriculture et alimentation
Budgets annexes;Publications officielles et information administrative;P624;Pilotage et ressources humaines;10939;P624.1;Optimiser les fonctions soutien;11965;P624.1.2;Ratio d'efficience de la gestion des ressources humaines;Contribuable;;16231;Ratio d'efficience de la gestion des ressources humaines;%;2,85;2,81;2,65;2.74;2.9;2020;2.39;MIN12;Services du Premier ministre
Budget général;Défense;P178;Préparation et emploi des forces;170;P178.5;Assurer la préparation des forces dans les délais impartis pour permettre la montée en puissance maximale des capacités militaires prévues;168;P178.5.2;Disponibilité des matériels par rapport aux exigences des contrats opérationnels;Citoyen;;16517;Marine nationale Guet aérien, Patrouille et surveillance maritime;%;57;57;56;52;57;2020;58;MIN70;Armées
Budget général;Recherche et enseignement supérieur;P172;Recherches scientifiques et technologiques pluridisciplinaires;630;P172.3;Participer activement à la construction de l'Europe de la recherche;11680;P172.3.1;Présence des opérateurs du programme dans les projets financés par le PCRD de l'Union européenne;Citoyen;;23039;Taux de sélection des projets des équipes françaises;%;17,6;14,7;SO;14.6;14.2;2020;14.5;MIN38;Enseignement supérieur, recherche et innovation
Budget général;Travail et emploi;P103;Accompagnement des mutations économiques et développement de l'emploi;933;P103.4;Faciliter l'insertion dans l'emploi par le développement de l'alternance et des titres professionnels;4799;P103.4.2;Taux d'insertion dans l'emploi des salariés ayant bénéficié d'un contrat de professionnalisation;Citoyen;;7203;Moins de 26 ans;%;54,1;nd;65;65;65;2020;nd;MIN36;Travail
Budget général;Action extérieure de l'État;P105;Action de la France en Europe et dans le monde;12;P105.3;Assurer un service diplomatique efficient et de qualité;10324;P105.3.2;Efficience de la fonction support;Contribuable;;12993;1. Ratio d'efficience de la gestion des ressources humaines;%;2,28;2,26;2,27;2.29;2.26;2020;2.27;MIN01;Europe et affaires étrangères
Budget général;Direction de l'action du Gouvernement;P129;Coordination du travail gouvernemental;268;P129.7;Optimiser le coût et la gestion des fonctions support;3372;P129.7.2;Efficience de la gestion immobilière;Contribuable;;18133;Ratio entretien lourd / SUB;€/m²;72;44,7;100;94.59;153.93;2020;100;MIN12;Services du Premier ministre
Budget général;Écologie, développement et mobilité durables;;;852;MTA.1 (P203.3);Améliorer la régulation dans les transports routiers et développer la part des modes alternatifs à la route;11154;P203.3.1;Part modale des transports non routiers;Citoyen;Stratégique mission;12812;Part modale des transports collectifs dans l'ensemble des transports intérieurs terrestres de voyageurs;%;19,7;18,2;19,7;18.3;18.7;2020;>19,8;;
